{
  "schema_version": "1.0.0",
  "module_id": "M09",
  "workspace_id": "WS-DEMO",
  "case_revision_id": "CASE-DEMO-001-R1",
  "run_id": "RUN-FIXTURE-001",
  "execution_status": "partial",
  "scientific_status": "undetermined",
  "input_refs": [
    "CASE-DEMO-001-R1"
  ],
  "output_refs": [
    "ASSESSMENT-FIXTURE-001"
  ],
  "evidence_refs": [],
  "warnings": [
    {
      "code": "composition_unknown",
      "message": "Количественный состав и конкретный продукт не определены.",
      "severity": "warning"
    }
  ],
  "missing_inputs": [
    "product_revision_ref",
    "quantitative_composition",
    "dose"
  ],
  "tool_versions": {
    "fixture_generator": "1.0.0"
  },
  "policy_version": "fixture-policy-1",
  "created_at": "2026-10-18T00:00:00Z",
  "content_hash": "0f928ff88fbb967ac37ee073e0045d0a7d0fdaa3a081ca70bf070b1bbcd4fb18"
}
